example_id,source_family,source_register,target_register,nahuatl_text,morpheme_segmentation,gloss_line,translation_en,translation_es,operation,evidence_status,source_reference,editorial_note
FCN-GRM-B-0001,grammar_example_bank,MSN_neutral,MSN_neutral,Inin tlahtōlli īpan MSN neutral māquixtia cencah machiyōtl.,Inin tlahtōlli īpan MSN neutral mā-quixtia cencah machiyōtl,this discourse in MSN neutral OPT-produce great clarity,"In MSN neutral, this discourse should produce clarity.","En MSN neutral, este discurso debe producir claridad.",editorial,editorially_normalized,Editorial model,Model neutral-prose sentence.
FCN-GRM-B-0002,grammar_example_bank,MSN_neutral,MSN_neutral,EHN ītech tlakakilistli; MSN neutral ītech tlahcuilōlistli.,EHN ī-tech tla-kaki-liztli; MSN neutral ī-tech tlah-cuilō-liztli,EHN in-at hearing-NMLZ; MSN neutral in-at writing-NMLZ,EHN belongs to hearing/speech; MSN neutral belongs to writing.,EHN pertenece a la escucha/habla; MSN neutral pertenece a la escritura.,editorial,constructed_pedagogical,Editorial model,Contrastive explanatory sentence.
MSN-CONV-0003,register_conversion,EHN,MSN_neutral,siwatl,,,,,orthographic_only,editorially_normalized,register_conversion/ehn_to_msn_neutral_examples.csv,Already aligned to MSN-style phonemic spelling.
MSN-CONV-0004,register_conversion,EHN,MSN_neutral,kuawitl,,,,,orthographic_only,editorially_normalized,register_conversion/ehn_to_msn_neutral_examples.csv,Canonical w/k spelling retained.
MSN-CONV-0005,register_conversion,EHN,MSN_neutral,akatl,,,,,orthographic_only,editorially_normalized,register_conversion/ehn_to_msn_neutral_examples.csv,Stable neutral headword form.
MSN-CONV-0006,register_conversion,EHN,MSN_neutral,Quēn moxēloa tōnatiuh?,,,,,spoken_to_written_stabilization,editorially_normalized,register_conversion/ehn_to_msn_neutral_examples.csv,Lesson-style spoken material preserved in neutral writing where already teachable.
MSN-CONV-0007,register_conversion,EHN,MSN_neutral,Ximoquētza!,,,,,spoken_to_written_stabilization,editorially_normalized,register_conversion/ehn_to_msn_neutral_examples.csv,Imperative preserved; no poetic elevation.
